Primary_Organization,Subordinate_Organization,Type,Sub_Type,City,County,ZIP
"Department of Developmental Services, State of California","Department of Developmental Services, State of California",Community-Based Organizations,Other community-based service provider,Sacramento,#N/A,95814
Department of Public Health/SAPC,Los Angeles County Department of Public Health,Counties,Department of public health,Los Angeles,#N/A,90012
Department of State Hospitals,Department of State Hospitals - Napa,Acute Care Settings,Psychiatric hospital,Napa,#N/A,94558
Department of State Hospitals,Department of State Hospitals - Coalinga,Acute Care Settings,Psychiatric hospital,Coalinga,#N/A,93210
Department of State Hospitals,Department of State Hospitals - Metropolitan,Acute Care Settings,Psychiatric hospital,Norwalk,#N/A,90650
Department of State Hospitals,Department of State Hospitals - Atascadero,Acute Care Settings,Psychiatric hospital,Atascadero,#N/A,93422
Department of State Hospitals,Department of State Hospitals - Patton,Acute Care Settings,Psychiatric hospital,Patton,#N/A,92369
"Dermatologist Medical group of North County, Inc.",none identified,Ambulatory Care Settings,Physician practice,Oceanside,#N/A,92056
Dermatology Consultants of Sacramento,none identified,Ambulatory Care Settings,Physician practice,Sacramento,#N/A,95819
Dermatology Medical Group of Oxnard and Camarillo,none identified,Ambulatory Care Settings,Physician practice,Oxnard,#N/A,93036
"Dermatology Specialists, Inc.",none identified,Ambulatory Care Settings,Physician practice,Oceanside,#N/A,92056
Desert Canyon Post Acute,none identified,Subacute Care Facility,Skilled nursing facility,Lancaster,#N/A,93534
Desert Medical Advances,none identified,Ambulatory Care Settings,Physician practice,Rancho Mirage,#N/A,92270
Desert Oasis Healthcare,none identified,Ambulatory Care Settings,Medical group,Palm Springs,#N/A,92262
"Desert Orthopedic Center A Medical Group, Inc.",none identified,Ambulatory Care Settings,Physician practice,Rancho Mirage,#N/A,92270
Desert Primary Care,none identified,Acute Care Settings,Other acute care setting,Palm Springs,#N/A,92262
Desert Regional Medical Center,none identified,Acute Care Settings,not selected,Palm Springs,#N/A,92262
Desert Rheumatology Clinic,none identified,Ambulatory Care Settings,not selected,La Quinta,#N/A,92253
Devang Shah,none identified,Ambulatory Care Settings,Physician practice,Morgan Hill,#N/A,95037
DHHS-Behavioral Health,none identified,Counties,"Behavioral health plan (SMH plans, Medi-Cal RX and DMC-ODS entities)",Eureka,#N/A,95501
DIABETES ASSOCIATES MEDICAL GROUP,none identified,Ambulatory Care Settings,Medical group,Orange,#N/A,92868
Diagnostic Pathology Services of the Central Coast,none identified,Ambulatory Care Settings,Physician practice,San Luis Obispo,#N/A,93403-5158
Didi Hirsch Mental Health Services,none identified,Community-Based Organizations,Other community-based service provider,Culver City,#N/A,90230
Dignity Adult Day Health Care Center,none identified,Ancillary Care,Other ancillary care provider,MONTCLAIR,#N/A,91763
Dimple Agarwal MD,none identified,Ambulatory Care Settings,Physician practice,Palm Springs,#N/A,92262
"Dirk R. Diefendorf, MD",none identified,Ambulatory Care Settings,Physician practice,San Mateo,#N/A,94401
Doctor,none identified,not selected,not selected,Riverside,#N/A,92506
"Doctors Hospital of Riverside, LLC dba Parkview Community Hospital Medical Center",none identified,Acute Care Settings,General acute care hospital,Riverside,#N/A,92503
"Doctors on Duty Medical Group, Inc.",none identified,Ambulatory Care Settings,Urgent care,Salinas,#N/A,93902-2300
Doctors Without Walls - Santa Barbara Street Medicine,none identified,Community-Based Organizations,Other community-based service provider,Santa Barbara,#N/A,93013
Dominican Hospital,none identified,Acute Care Settings,Other acute care setting,Santa Cruz,#N/A,95065
Donald E. Wallens M.D. A Medical Co,none identified,not selected,not selected,Los Angeles,#N/A,90067
DONALD I KUZYK DPM INC,none identified,Ambulatory Care Settings,Physician practice,SIMI VALLEY,#N/A,930651208
"Donald K Schubert, Ph.D.",none identified,Ancillary Care,Other ancillary care provider,MISSION VIEJO,#N/A,92692
Donald Ware MD,none identified,Ambulatory Care Settings,Physician practice,Los Angeles,#N/A,90008
"Douglas Chin, MD",none identified,Ambulatory Care Settings,Physician practice,Oakland,#N/A,94612
"Douglas W. Ankrom, MD Inc",none identified,Ambulatory Care Settings,Physician practice,Sonora,#N/A,95370
Dr Aditya Jain Md Inc,none identified,Ambulatory Care Settings,Medical group,San Leandro,#N/A,94578
Dr Christina Hopson,none identified,Acute Care Settings,General acute care hospital,Roseville,#N/A,95661
Dr Curtis Kodama and Associates Inc.,none identified,Ambulatory Care Settings,Physician practice,Moorpark,#N/A,93021
Dr Graham Hurvitz Corporation,none identified,not selected,not selected,Santa Barbara,#N/A,93105
Dr Halyna West INC,none identified,Ambulatory Care Settings,Physician practice,San Diego,#N/A,92037
DR WALTER F D'COSTA,none identified,Ambulatory Care Settings,Physician practice,Santa Rosa,#N/A,95403
Dr. Catherine Chimenti,none identified,Ambulatory Care Settings,Physician practice,Burlingame,#N/A,94010
Dr. Edgar Martinez DO Inc,Dr. Edgar Martinez DO INC.,Ancillary Care,Other ancillary care provider,Huntington Park,#N/A,90255
Dr. Edgar Martinez DO Inc,Dr. Edgar Martinez DO INC.,Ancillary Care,Other ancillary care provider,Huntington Park,#N/A,90255
"Dr. Indira Vemuri,P.C.",none identified,Ambulatory Care Settings,Physician practice,Morgan Hill,#N/A,95037
"Dr. Mark S. Cramer, MD, FAAFP",none identified,Ambulatory Care Settings,not selected,San Diego,#N/A,92122
Dr. Marupuru a professional corporation,none identified,Ambulatory Care Settings,Physician practice,Palm Springs,#N/A,92262
Dr. Michael Girolami,none identified,Ambulatory Care Settings,Physician practice,Burlingame,#N/A,94010
Dr. Mona Mofid,none identified,Ambulatory Care Settings,Physician practice,San Diego,#N/A,92122-1008
Dr. Nina K Maw Maw MD INC,none identified,Ambulatory Care Settings,Physician practice,Rancho Mirage,#N/A,92270
Dr. Niveen Abdelmessih,none identified,Ambulatory Care Settings,not selected,Glendale,#N/A,91208
"Dr. Xie, Inc",none identified,Ambulatory Care Settings,Physician practice,Burlingame,#N/A,94010
DR. ZHOU'S OB/GYN PROFESSIONAL CORPORATION,none identified,Ambulatory Care Settings,Physician practice,Burlingame,#N/A,94010
Duggal Medical Corp Inc,none identified,Ambulatory Care Settings,Physician practice,Modesto,#N/A,95356
"Duhaney Home Health Care , Inc",none identified,Community-Based Organizations,Other community-based service provider,Los Angeles,#N/A,90045
Durga Madala MD Inc.,none identified,Ambulatory Care Settings,Physician practice,San Jose,#N/A,95124
Dustin Raber Md inc,none identified,Ambulatory Care Settings,Physician practice,riverdale,#N/A,93656
Dynasty valley llc,Crescent City Skilled Nursing,Intermediaries,Health Information Exchange Intermediary Organization (HIO),crescent city,#N/A,95531
E.MIKE VASILOMANOLAKIS MD,none identified,Emergency Medical Service Providers,not selected,Long Beach,#N/A,90804
EA Family Services,none identified,Community-Based Organizations,Other community-based service provider,Quincy,#N/A,95971
Ear Nose and Throat Associates of San Diego A Medical Corporation,Ear Nose and Throat Associates of San Diego,Ancillary Care,Clinical laboratory,La Mesa,#N/A,91942
Ear Nose and Throat Associates of San Diego A Medical Corporation,Ear Nose and Throat Associates of San Diego,Ancillary Care,Clinical laboratory,Chula Vista,#N/A,91911
Ear Nose and Throat Associates of San Diego A Medical Corporation,Ear Nose and Throat Associates of San Diego,Ancillary Care,Clinical laboratory,San Diego,#N/A,92130
Ear Nose and Throat Associates of San Mateo County,none identified,Ambulatory Care Settings,Physician practice,San Mateo,#N/A,94401
East Bay Cardiovascular and Thoracic Associates,none identified,Ambulatory Care Settings,Physician practice,Danville,#N/A,94526
East Bay Center for Digestive Health,none identified,Ambulatory Care Settings,Physician practice,Oakland,#N/A,94612
"East Bay Hand Medical Center, Inc",none identified,Ambulatory Care Settings,not selected,San Leandro,#N/A,94578
EAST BAY MEDICAL PROFESSIONAL CORPORATION,none identified,Ambulatory Care Settings,Physician practice,Dublin,#N/A,94568
"East Bay Nephrology Medical Group, Inc.",none identified,Ambulatory Care Settings,Physician practice,Berkeley,#N/A,94705
"East Bay Neurosurgery and Spine, Inc",none identified,Ambulatory Care Settings,not selected,Berkeley,#N/A,94705
East County Cardiology,none identified,Ambulatory Care Settings,Physician practice,Antioch,#N/A,94509
"East Valley Community Health Center, Inc.",none identified,Community-Based Organizations,Other community-based service provider,West Covina,#N/A,91790
Eastern Medical Center,none identified,Ambulatory Care Settings,Physician practice,Sacramento,#N/A,95821
Eastern Plumas Health Care,none identified,Acute Care Settings,General acute care hospital,Portola,#N/A,96122-9406
EASTSIDE FAMILY MEDICAL ASSOCIATES,none identified,Ambulatory Care Settings,Physician practice,Los Angeles,#N/A,90022
"EasyCare Management, INC.",none identified,Community-Based Organizations,Other community-based service provider,West Hills,#N/A,91307
Eat Ahara,none identified,Community-Based Organizations,Other community-based service provider,Los Angeles,#N/A,90036
Ebbetts Pass Fire District,none identified,Emergency Medical Service Providers,not selected,Arnold,#N/A,95223
Ebtesam Girgis MFT,none identified,Ancillary Care,Other ancillary care provider,Huntington Beach,#N/A,92649
"Eden I & R, Inc.",none identified,Community-Based Organizations,Other community-based service provider,Hayward,#N/A,94541
Edgewood Center for Children and Families,none identified,Ambulatory Care Settings,Mental health clinic,San Francisco,#N/A,94116
Edinger Medical Group,none identified,Ancillary Care,Other ancillary care provider,Fountain Valley,#N/A,92708
"EDMOND CHAN MD, A MED CORP",none identified,Ambulatory Care Settings,Physician practice,Poway,#N/A,92064
"Edmund Fisher, MD, Inc.",none identified,not selected,not selected,Bakersfield,#N/A,93309
"Edmund H. Lew, MD, Inc.",none identified,Ambulatory Care Settings,Physician practice,Glendale,#N/A,91206
"Eduro Healthcare, LLC",Stockton Nursing Center,Subacute Care Facility,Skilled nursing facility,Stockton,#N/A,95207
"Eduro Healthcare, LLC",Fresno Nursing Center,Subacute Care Facility,Skilled nursing facility,Fresno,#N/A,93726
"Eduro Healthcare, LLC",Oakhurst Healthcare Center,Subacute Care Facility,Skilled nursing facility,Oakhurst,#N/A,93644
Edward A Weiss MD INC,none identified,Ambulatory Care Settings,Physician practice,Palo Alto,#N/A,94301
Edward kocharian MD APC,none identified,Ambulatory Care Settings,Physician practice,La Jolla,#N/A,92037
Edward Oklan,none identified,Ambulatory Care Settings,Physician practice,San Rafael,#N/A,94903
"Edward Ruiz, MD",none identified,not selected,not selected,La Quinta,#N/A,92253
"Edward Sun, M.D., Inc.",none identified,Acute Care Settings,Other acute care setting,San Mateo,#N/A,94401
Ehritt Hearing Services,none identified,Ambulatory Care Settings,Independent practice associations,SCOTTS VALLEY,#N/A,95066
Eisenhower Medical Center,none identified,Acute Care Settings,General acute care hospital,Rancho Mirage,#N/A,92270
Eisner Health,none identified,Community-Based Organizations,Other community-based service provider,Los Angeles,#N/A,90015
El Dorado County,none identified,not selected,not selected,Diamond Springs,#N/A,95667
El Dorado County Community Health Center,none identified,Ambulatory Care Settings,Federally Qualified Health Center (FQHC),Placerville,#N/A,95667
"El Proyecto del Barrio, Inc.",none identified,Community-Based Organizations,Other community-based service provider,arleta,#N/A,91331
Elevance CareMore,none identified,Plans,Health care service plans and disability insurer,Rancho Cucamonga,#N/A,91739
Elica Health Centers,none identified,Ambulatory Care Settings,Federally Qualified Health Center (FQHC),Sacramento,#N/A,95825
"Elisa C. Brown, M.D.",none identified,Ambulatory Care Settings,Physician practice,Chico,#N/A,95926
"Elite Primary Physicians, Inc",none identified,Ambulatory Care Settings,Physician practice,Anaheim,#N/A,92805
Elite Urgent Care,none identified,Acute Care Settings,Other acute care setting,Modesto,#N/A,95350
ELITE WOMEN HEALTH APMC,none identified,Ancillary Care,Other ancillary care provider,Bakersfield,#N/A,93301
"Elizabeth Hegarty, MD",none identified,not selected,not selected,Santa Rosa,#N/A,95404
"Elizabeth Rawson, MD",none identified,Ambulatory Care Settings,Physician practice,San Francisco,#N/A,94115
"Eloy Romero, MD., Inc. A Professional Corporation",none identified,Ambulatory Care Settings,Physician practice,Salinas,#N/A,93906
"Elyse Rubenstein, MD A Professional Coroporation",none identified,Ambulatory Care Settings,Physician practice,Santa Monica,#N/A,90404
Emanate Health,Emanate Health Medical Center,Acute Care Settings,General acute care hospital,Covina,#N/A,91723
Emanate Health,Emanate Health Foothill Presbyterian Hospital,Acute Care Settings,General acute care hospital,Glendora,#N/A,91741
Emanate Health,Emanate Health Hospice,Subacute Care Facility,Skilled nursing facility,West Covina,#N/A,91791
Emanate Health,Emanate Health Queen of the Valley Hospital Clinical Laboratory,Ancillary Care,Clinical laboratory,West Covina,#N/A,91790
Emanate Health,Emanate Health Medical Center Inter-Community Hospital Clinical Lab,Ancillary Care,Clinical laboratory,Covina,#N/A,91723
Emcara Health,"PopHealthCare, LLC",Community-Based Organizations,Continuum of Care organization (CoC),Franklin,#N/A,37067
Emily Bruckner,none identified,Ambulatory Care Settings,Physician practice,Los Angeles,#N/A,90025
"Empire Physicians Medical Group, Inc.",none identified,Ambulatory Care Settings,Medical group,Palm Desert,#N/A,92211
Empress Care Center,none identified,Subacute Care Facility,Skilled nursing facility,San Jose,#N/A,95128-3514
encompass housing,none identified,Community-Based Organizations,Other community-based service provider,Santa Ana,#N/A,92704
"English Channel Holdings, LLC",none identified,Community-Based Organizations,Other community-based service provider,Lodi,#N/A,95240
Enloe Medical center,none identified,Acute Care Settings,General acute care hospital,Chico,#N/A,95926
"Enrique Espinosa-Melendez, MD",none identified,Emergency Medical Service Providers,not selected,Chula Vista,#N/A,91911
Ensign Pleasanton LLC DBA Ukiah Post Acute,none identified,Ancillary Care,Other ancillary care provider,Ukiah,#N/A,95482
Ensign Willits LLC DBA Northbrook Healthcare Center,none identified,Subacute Care Facility,Skilled nursing facility,Willits,#N/A,95490
Enterprise Elementary School District,none identified,Community-Based Organizations,Other community-based service provider,Redding,#N/A,96002
Epic Care,none identified,Ambulatory Care Settings,Physician practice,Antioch,#N/A,94509
Epic Health Plan,none identified,Plans,Health care service plans and disability insurer,Redlands,#N/A,92374
Equal Tox,none identified,Ancillary Care,Clinical laboratory,Santa Ana,#N/A,92705
Eric Hansen Family Practice,Eric R Hansen DO Prof Corp,Ambulatory Care Settings,not selected,Hesperia,#N/A,92345
Eric Roberto Batres Medical Corporation,none identified,Ambulatory Care Settings,Physician practice,Bell,#N/A,90201
ERIC TABAS MD INC,none identified,Ambulatory Care Settings,Physician practice,San Francisco,#N/A,94108
"ERICA RUIZ, MD",none identified,not selected,not selected,La Quinta,#N/A,92253
Erick Madrigal MD MBA INC,Erick Madrigal MD MBA INC,Ambulatory Care Settings,not selected,Visalia,#N/A,93277
Erick Madrigal MD MBA INC,Erick Madrigal MD MBA INC,Ambulatory Care Settings,not selected,Lindsay,#N/A,93257
"Erik C. Spayde, M.D. Inc",St. Charles Spine Institute,Community-Based Organizations,Other community-based service provider,Thousand Oaks,#N/A,91360
"Erik C. Spayde, M.D. Inc",St Charles Imaging Center,Ancillary Care,Imaging/radiology center,Thousand,#N/A,91360
"Erika Novak, L.Ac.",none identified,Ambulatory Care Settings,Independent practice associations,San Diego,#N/A,92122
Escondido Internal Medicine,none identified,Ambulatory Care Settings,Physician practice,Escondido,#N/A,92025
Eureka Radiation Oncology Consultants,none identified,Ambulatory Care Settings,not selected,Blue Lake,#N/A,95525
Evans Hand Therapy,none identified,Community-Based Organizations,Other community-based service provider,Anaheim,#N/A,92805
"Exact Sciences Laboratories, LLC",none identified,Ancillary Care,Clinical laboratory,Madison,#N/A,53711
Exagen,none identified,Ancillary Care,Clinical laboratory,vista,#N/A,92081
Excellence in Rehabilitation Medical Group Inc,none identified,Acute Care Settings,Other acute care setting,Santa Barbara,#N/A,93110
Exodus Recovery Inc.,none identified,Community-Based Organizations,Other community-based service provider,Culver City,#N/A,90232
"Exodus Recovery, Inc",none identified,Community-Based Organizations,Other community-based service provider,Fresno,#N/A,93726
Extended Care Hosp of Westminster,none identified,Subacute Care Facility,Skilled nursing facility,Westminster,#N/A,92683
Eye Physician Med/Surg Center,none identified,Ambulatory Care Settings,Physician practice,Chula Vista,#N/A,91910
Eye Physicians Medical Surgical Center,none identified,Ambulatory Care Settings,Physician practice,Chula Vista,#N/A,91910
Eye Site Sacramento Medical Group,none identified,Ambulatory Care Settings,Medical group,Sacramento,#N/A,95819
F. Jimenez Medical Corporation,none identified,Ambulatory Care Settings,Physician practice,Upland,#N/A,91786
"Fairfield Health Care, Inc.",none identified,Community-Based Organizations,Other community-based service provider,Fairfield,#N/A,94533
Fairmont Rehabilitation Hospital,none identified,Community-Based Organizations,Other community-based service provider,Lodi,#N/A,95240
Fairway Children's Medical Group,none identified,Ambulatory Care Settings,Physician practice,West Covina,#N/A,91792
"Family Allergy, Asthma, Immunology & Sinus Center P.C.",none identified,Ambulatory Care Settings,Physician practice,Poway,#N/A,92064
Family Choice Health Services,none identified,Plans,Health care service plans and disability insurer,Westminster,#N/A,92683
"Family Choice Medical Group, Inc.",none identified,Ambulatory Care Settings,Medical group,Westminster,#N/A,92683
Family First Medical Care,none identified,Ambulatory Care Settings,Independent practice associations,Modesto,#N/A,95355
Family Health Care Centers of Greater LA,none identified,Community-Based Organizations,Other community-based service provider,Bell Gardens,#N/A,90201-1805
"Family Health Centers of San Diego, INC",none identified,Ambulatory Care Settings,Federally Qualified Health Center (FQHC),San Diego,#N/A,92102
Family HealthCare Network,none identified,Ambulatory Care Settings,Federally Qualified Health Center (FQHC),Visalia,#N/A,93291
Family Justice Center Sonoma County,none identified,Community-Based Organizations,Other community-based service provider,Santa Rosa,#N/A,95403
Family Service Agency of Santa Barbara County,none identified,Community-Based Organizations,Other community-based service provider,Santa Barbara,#N/A,93101
Fareeda Adeeb M.D Pediatrics,none identified,Ambulatory Care Settings,Physician practice,San Jose,#N/A,95128
Fariba Akhavon MD,none identified,Ambulatory Care Settings,Physician practice,Visalia,#N/A,93291
Farid Saadat MD,none identified,Ambulatory Care Settings,Physician practice,Lake Elsinore,#N/A,92530
"Farr Medical Group, Inc.",none identified,Ambulatory Care Settings,Medical group,Bakersfield,#N/A,93312
Father Joe's VIllages,none identified,not selected,not selected,San Diego,#N/A,92102
Feather River Care Center,none identified,Ancillary Care,Other ancillary care provider,Oroville,#N/A,95966
Feather River Health Solutions,none identified,Ambulatory Care Settings,Medical group,Live Oak,#N/A,95953
"Felix R. Gaw, MD, Inc",none identified,Ambulatory Care Settings,Physician practice,Anaheim,#N/A,92801
Fellowship Homes INC dba Casa de Modesto,none identified,Community-Based Organizations,Other community-based service provider,Modesto,#N/A,95350
Felton Institute,none identified,Community-Based Organizations,Other community-based service provider,Alameda,#N/A,94501
"Feras and Hisham, A Medical Corporation",none identified,Ambulatory Care Settings,Physician practice,Pomona,#N/A,91766
Fertility Care of Orange County,none identified,Ancillary Care,Other ancillary care provider,Brea,#N/A,92821
FiCare Med,none identified,Ambulatory Care Settings,Physician practice,Poway,#N/A,92064
Filomena S Pascual MD Inc,none identified,Ambulatory Care Settings,Physician practice,Rancho Cucamonga,#N/A,91730
FishmanVision,none identified,Ambulatory Care Settings,Physician practice,Palo Alto,#N/A,94301
Flagstone Healthcare Central LLC,Ensign San Dimas LLC dba Arbor Glen Care Center,Subacute Care Facility,Skilled nursing facility,Glendora,#N/A,91740
Flagstone Healthcare Central LLC,Redbrook Healthcare Associates LLC dba Brookside Healthcare Center,Subacute Care Facility,Skilled nursing facility,Redlands,#N/A,92373
Flagstone Healthcare Central LLC,"Camarillo Community Care, Inc. dba Camarillo Healthcare Center",Subacute Care Facility,Skilled nursing facility,Camarillo,#N/A,93010
Flagstone Healthcare Central LLC,"Powers Park Healthcare, Inc. dba Channel Islands Post Acute",Subacute Care Facility,Skilled nursing facility,Santa Barbara,#N/A,93110
Flagstone Healthcare Central LLC,Claremont Foothills Health Associates LLC dba Claremont Care Center,Subacute Care Facility,Skilled nursing facility,Pomona,#N/A,91767
Flagstone Healthcare Central LLC,C Street Health Associates LLC dba Glenwood Care Center,Subacute Care Facility,Skilled nursing facility,Oxnard,#N/A,93030
Flagstone Healthcare Central LLC,"Empirecare Health Associates, LLC dba The Grove Care and Wellness",Subacute Care Facility,Skilled nursing facility,Riverside,#N/A,92501
Flagstone Healthcare Central LLC,Ramon Healthcare Associates LLC dba Mission Care Center,Subacute Care Facility,Skilled nursing facility,Rosemead,#N/A,91770
Flagstone Healthcare Central LLC,Ensign Panorama LLC dba Panorama Gardens Nursing and Rehabilitation Center,Subacute Care Facility,Skilled nursing facility,Panorama City,#N/A,91402
Flagstone Healthcare Central LLC,Ensign Palm I LLC dba Premier Care Center for Palm Springs,Subacute Care Facility,Skilled nursing facility,Palm Springs,#N/A,92264
Flagstone Healthcare Central LLC,"Upland Community Care, Inc. dba Upland Rehabilitation and Care Center",Subacute Care Facility,Skilled nursing facility,Upland,#N/A,91786
Flagstone Healthcare Central LLC,Victoria Ventura Healthcare LLC dba Victoria Care Center,Subacute Care Facility,Skilled nursing facility,ventura,#N/A,93003
Flagstone Healthcare Central LLC,"Santa Maria Healthcare, Inc. dba Villa Maria Post Acute",Subacute Care Facility,Skilled nursing facility,Santa Maria,#N/A,93454
Flagstone Healthcare North LLC,Ensign Sonoma LLC,Subacute Care Facility,Skilled nursing facility,Sonoma,#N/A,95476-7500
Flagstone Healthcare North LLC,Ensign Cloverdale LLC,Subacute Care Facility,Skilled nursing facility,Cloverdale,#N/A,95425-3811
Flagstone Healthcare North LLC,Ensign Willits LLC,Subacute Care Facility,Skilled nursing facility,Willits,#N/A,95490-7313
Flagstone Healthcare North LLC,Ensign Montgomery LLC,Subacute Care Facility,Skilled nursing facility,Santa Rosa,#N/A,95405-5214
Flagstone Healthcare North LLC,Ensign Santa Rosa LLC,Subacute Care Facility,Skilled nursing facility,Santa Rosa,#N/A,95405-7313
Flagstone Healthcare North LLC,Ensign Pleasanton LLC,Subacute Care Facility,Skilled nursing facility,Ukiah,#N/A,95482-6512
Flagstone Healthcare North LLC,"Bouverie Healthcare Services, Inc.",Subacute Care Facility,Skilled nursing facility,Sonoma,#N/A,95476-7500
Flagstone Healthcare South LLC,City Heights Health Associates LLC,Subacute Care Facility,Skilled nursing facility,San Diego,#N/A,92105-4302
Flagstone Healthcare South LLC,"Atlantic Memorial Healthcare Associates, Inc.",Subacute Care Facility,Skilled nursing facility,Long Beach,#N/A,90806-2713
Flagstone Healthcare South LLC,Downey Community Care LLC,Subacute Care Facility,Skilled nursing facility,Downey,#N/A,90240-2425
Flagstone Healthcare South LLC,"Pine Forest Healthcare, Inc.",Subacute Care Facility,Skilled nursing facility,HAWTHORNE,#N/A,90250-8118
Flagstone Healthcare South LLC,"Bernardo Heights Healthcare, Inc.",Subacute Care Facility,Skilled nursing facility,San Diego,#N/A,92128-3423
Flagstone Healthcare South LLC,"Nautilus Healthcare, Inc.",Subacute Care Facility,Skilled nursing facility,La Jolla,#N/A,92037-5511
Flagstone Healthcare South LLC,"Rio Hondo Healthcare, Inc.",Subacute Care Facility,Skilled nursing facility,Downey,#N/A,90242-4329
Flagstone Healthcare South LLC,"Devonshire Healthcare, Inc.",Subacute Care Facility,Skilled nursing facility,San Diego,#N/A,92102-2416
Flagstone Healthcare South LLC,"Mission Trails Healthcare, Inc.",Subacute Care Facility,Skilled nursing facility,La Mesa,#N/A,91942-3034
Flagstone Healthcare South LLC,"Tustin Hills Healthcare, Inc.",Subacute Care Facility,Skilled nursing facility,Santa Ana,#N/A,92705-7810
Flagstone Healthcare South LLC,Lemon Grove Health Associates LLC,Subacute Care Facility,Skilled nursing facility,Lemon Grove,#N/A,91945-2009
Flagstone Healthcare South LLC,"Jefferson Healthcare, LLC",Subacute Care Facility,Skilled nursing facility,El Cajon,#N/A,92020-6012
