Primary_Organization,Subordinate_Organization,Type,Sub_Type,City,County,ZIP
Lassen County Behavioral Health,none identified,Counties,"Behavioral health plan (SMH plans, Medi-Cal RX and DMC-ODS entities)",Lassen,#N/A,96130
Latara Enterprise Inc. dba Foundation Laboratory,none identified,Ancillary Care,Clinical laboratory,Pomona,#N/A,91768
Laura N. Petrovich,none identified,Ambulatory Care Settings,Physician practice,Coronado,#N/A,92118
LAUREL HEIGHTS COMMUNITY CARE,none identified,Subacute Care Facility,Skilled nursing facility,San Francisco,#N/A,94115
Laurel Schramm MD,none identified,Ambulatory Care Settings,not selected,Los Angeles,#N/A,90048
"Lavinia Chong, M.D., Inc.",none identified,not selected,not selected,Newport Beach,#N/A,92660
Lawrence L Lin MD,Georgeanna J Huang MD,Ambulatory Care Settings,Physician practice,Thousand Oaks,#N/A,91320
"Le Meilleur Health Care Services, Inc",none identified,Community-Based Organizations,Other community-based service provider,Ontario,#N/A,91762
LEGACY POST-ACUTE REHABILITATION CENTER,none identified,Subacute Care Facility,Skilled nursing facility,San Bernardino,#N/A,92404-5385
Legal Aid of Sonoma County,none identified,Community-Based Organizations,Other community-based service provider,Santa Rosa,#N/A,95404
Leisure Court Nursing Center,none identified,Subacute Care Facility,Skilled nursing facility,Anaheim,#N/A,92801
"Leomar Health Group, Inc.",none identified,Community-Based Organizations,Continuum of Care organization (CoC),Carlsbad,#N/A,92010
Leslie Kaplan MD,none identified,Ambulatory Care Settings,Physician practice,Calabasas,#N/A,91302
Lestonnac Free Clinic,none identified,Community-Based Organizations,Other community-based service provider,Orange,#N/A,92866
"Level Home Health, Inc",none identified,Ancillary Care,Other ancillary care provider,Pasadena,#N/A,91101
Libertana,none identified,Community-Based Organizations,Other community-based service provider,Sherman Oaks,#N/A,91411
Life Connect Medical,none identified,Ambulatory Care Settings,Physician practice,Rancho Mirage,#N/A,92270
LifeLine Ambulance Service,none identified,Emergency Medical Service Providers,not selected,Commerce,#N/A,90040
LifeLong Medical Care,none identified,Ambulatory Care Settings,Federally Qualified Health Center (FQHC),Berkely,#N/A,94710
LifeStart Fertility Center,none identified,Ambulatory Care Settings,Physician practice,Agoura Hills,#N/A,91301
"Lifestyle Works, LLC",none identified,Ancillary Care,Other ancillary care provider,Cool,#N/A,95614
LightHouse for the Blind and Visually Impaired,none identified,Community-Based Organizations,Other community-based service provider,San Francisco,#N/A,94103
LILY ENAYATI MD INC,none identified,Ambulatory Care Settings,Physician practice,San Mateo,#N/A,94402
LINA C SHAMMAS DO INC,none identified,Ambulatory Care Settings,Physician practice,Burbank,#N/A,91506
Lincoln Glen Skilled Nursing,none identified,Subacute Care Facility,Skilled nursing facility,San Jose,#N/A,95125
"Lisa Considine, D.O, Inc",none identified,Ambulatory Care Settings,Physician practice,Coronado,#N/A,92118
Little Manila Foundation,none identified,Community-Based Organizations,Other community-based service provider,Stockton,#N/A,95206
Livingstone Community Health Clinic,none identified,Ambulatory Care Settings,not selected,Stanton,#N/A,90680
"Livingwater's Medical Clinic, Inc.",none identified,Ambulatory Care Settings,Physician practice,Murrieta,#N/A,92562
"Liza Presser Belkin, MD Inc.",none identified,Ambulatory Care Settings,Physician practice,Santa Barbara,#N/A,93111
"LJMP, LP Capri in the Desert",none identified,Subacute Care Facility,Skilled nursing facility,Studio City,#N/A,91604
LMDPR,none identified,Ambulatory Care Settings,Physician practice,marina del rey,#N/A,90292
LMS Physicians Care PC,none identified,Ambulatory Care Settings,Physician practice,Riverside,#N/A,92506
"Loan Truong, M.D., INC.",none identified,Ambulatory Care Settings,Physician practice,Long Beach,#N/A,90806
Logan M Haak MD Inc,none identified,Ambulatory Care Settings,not selected,San Diego,#N/A,92101
Loida V Guevarra MD Inc,none identified,Ambulatory Care Settings,Physician practice,victorville,#N/A,92395-8305
"Loma Vista Endocrinology, Inc.",none identified,Ambulatory Care Settings,Independent practice associations,ventura,#N/A,93003
Lomita Family Medical Group,none identified,Ambulatory Care Settings,Physician practice,San Diego,#N/A,92114
Lompoc Valley Medical Center,none identified,Acute Care Settings,not selected,Lompoc,#N/A,93436
Long Beach Post Acute,none identified,not selected,not selected,Long Beach,#N/A,90813
Long Beach Women's & Children,none identified,Ambulatory Care Settings,Physician practice,Long Beach,#N/A,90813
Long Health Inc,Long Health Inc,Intermediaries,Other intermediary,San Jose,#N/A,95148
Long Valley Health Center,none identified,Ambulatory Care Settings,Federally Qualified Health Center (FQHC),Laytonville,#N/A,95454
Longwood Management Corp.,Alameda Care Center,Subacute Care Facility,Skilled nursing facility,Burbank,#N/A,91506
Longwood Management Corp.,Alden Terrace Convalescent Hospital,Subacute Care Facility,Skilled nursing facility,Los Angeles,#N/A,90006
Longwood Management Corp.,Broadway Manor Care Center,Subacute Care Facility,Skilled nursing facility,Glendale,#N/A,91204
Longwood Management Corp.,Burbank Healthcare and Rehabilitation Center,Subacute Care Facility,Skilled nursing facility,Burbank,#N/A,91506
Longwood Management Corp.,Burlington Convalescent Hospital,Subacute Care Facility,Skilled nursing facility,Los Angeles,#N/A,90057
Longwood Management Corp.,California Healthcare and Rehabilitation Center,Subacute Care Facility,Skilled nursing facility,Van Nuys,#N/A,91411
Longwood Management Corp.,Casa Bonita Convalescent Hospital,Subacute Care Facility,Skilled nursing facility,San Dimas,#N/A,91773
Longwood Management Corp.,Cerritos Vista Healthcare Center,Subacute Care Facility,Skilled nursing facility,Bellflower,#N/A,90706
Longwood Management Corp.,Chino Valley Healthcare Center,Subacute Care Facility,Skilled nursing facility,Pomona,#N/A,91766
Longwood Management Corp.,Colonial Care Center,Subacute Care Facility,Skilled nursing facility,Long Beach,#N/A,90802
Longwood Management Corp.,Covina Rehabilitation Center,Subacute Care Facility,Skilled nursing facility,Covina,#N/A,91723
Longwood Management Corp.,Crenshaw Nursing Home,Subacute Care Facility,Skilled nursing facility,Los Angeles,#N/A,90016
Longwood Management Corp.,Eastland Subacute and Rehabilitation Center,Subacute Care Facility,Skilled nursing facility,El Monte,#N/A,91732
Longwood Management Corp.,Green Acres Healthcare Center,Subacute Care Facility,Skilled nursing facility,Rosemead,#N/A,91770
Longwood Management Corp.,Highland Springs Care Center,Subacute Care Facility,Skilled nursing facility,Beaumont,#N/A,92223
Longwood Management Corp.,Imperial Care Center,Subacute Care Facility,Skilled nursing facility,Studio City,#N/A,91604
Longwood Management Corp.,Imperial Crest Healthcare Center,Subacute Care Facility,Skilled nursing facility,HAWTHORNE,#N/A,90250
Longwood Management Corp.,Intercommunity Health and Rehab,Subacute Care Facility,Skilled nursing facility,Norwalk,#N/A,90650
Longwood Management Corp.,Laurel Convalescent Hospital,Subacute Care Facility,Skilled nursing facility,FONTANA,#N/A,92336
Longwood Management Corp.,Live Oak Rehabilitation Center,Subacute Care Facility,Skilled nursing facility,San Gabriel,#N/A,91776
Longwood Management Corp.,Longwood Manor Convalescent Hospital,Subacute Care Facility,Skilled nursing facility,Los Angeles,#N/A,90016
Longwood Management Corp.,Magnolia Gardens Convalescent Hospital,Subacute Care Facility,Skilled nursing facility,Granada Hills,#N/A,91344
Longwood Management Corp.,Mayflower Care Center,Subacute Care Facility,Skilled nursing facility,El Monte,#N/A,91732
Longwood Management Corp.,Meadows Ridge Care Center,Subacute Care Facility,Skilled nursing facility,Colton,#N/A,92324
Longwood Management Corp.,Montrose Healthcare Center,Subacute Care Facility,Skilled nursing facility,Montrose,#N/A,91020
Longwood Management Corp.,Northridge Care Center,Subacute Care Facility,Skilled nursing facility,Northridge,#N/A,91335
Longwood Management Corp.,Park Anaheim Healthcare Center,Subacute Care Facility,Skilled nursing facility,Anaheim,#N/A,92804
Longwood Management Corp.,Pico Rivera Healthcare Center,Subacute Care Facility,Skilled nursing facility,Pico Rivera,#N/A,90660
Longwood Management Corp.,San Gabriel Convalescent,Subacute Care Facility,Skilled nursing facility,Rosemead,#N/A,91770
Longwood Management Corp.,Santa Fe Lodge,Subacute Care Facility,Skilled nursing facility,El Monte,#N/A,91732
Longwood Management Corp.,Whittier Pacific Care Center,Subacute Care Facility,Skilled nursing facility,Whittier,#N/A,90602
Longwood Management Corp.,Sherman Oaks Health and Rehabilitation Center,Subacute Care Facility,Skilled nursing facility,Sherman Oaks,#N/A,91423
Longwood Management Corp.,Sherman Village Healthcare Center,Subacute Care Facility,Skilled nursing facility,N. Hollywood,#N/A,91607
Longwood Management Corp.,Studio City Rehabilitation Center,Subacute Care Facility,Skilled nursing facility,Studio City,#N/A,91604
Longwood Management Corp.,Sunnyview Care Center,Subacute Care Facility,Skilled nursing facility,Los Angeles,#N/A,90018
Longwood Management Corp.,View Park Convalescent Center,Subacute Care Facility,Skilled nursing facility,Los Angeles,#N/A,90008
Longwood Management Corp.,West Hills Health and Rehabilitation,Subacute Care Facility,Skilled nursing facility,Canoga Park,#N/A,91304
Longwood Management Corp.,Western Convalescent Hospital,Subacute Care Facility,Skilled nursing facility,Los Angeles,#N/A,90018
"Lori B. Birndorf, D.O., A Medical Corporation",none identified,Ambulatory Care Settings,Physician practice,Chatsworth,#N/A,91311
Lori R Krieger MD INC,none identified,Ambulatory Care Settings,Physician practice,San Pedro,#N/A,90732
Los Altos Subacute & Rehabilitation,none identified,Subacute Care Facility,Skilled nursing facility,Los Altos,#N/A,94024
Los Angeles Kidney Center,none identified,not selected,not selected,Los Angeles,#N/A,90024
Los Angeles LGBT Center,none identified,Ambulatory Care Settings,Federally Qualified Health Center (FQHC),Los Angeles,#N/A,90028
Los Angeles Network for Enhanced Services (LANES),none identified,Intermediaries,Qualified Health Information Exchange Intermediary Organization (QHIO),Los Angeles,#N/A,90064
Los Angeles Rehab,none identified,Subacute Care Facility,Skilled nursing facility,Los Angeles,#N/A,90057
"Louise Cooley Davis, M.D.",none identified,Ambulatory Care Settings,not selected,Beverly Hills,#N/A,90212-3411
Love Focus International Association,none identified,Community-Based Organizations,Other community-based service provider,Merced,#N/A,95248
LSS Nor Ca,none identified,Community-Based Organizations,Continuum of Care organization (CoC),Sacramento,#N/A,95817
Lucidity Sleep and Psychiatry,none identified,Ambulatory Care Settings,Physician practice,vista,#N/A,92081
Lucile Packard Children's Hospital Stanford,none identified,Acute Care Settings,General acute care hospital,Palo Alto,#N/A,94304
"Luis M. Marquez, MD, Inc",none identified,Ambulatory Care Settings,Physician practice,San Diego,#N/A,92103
Lumeris/Essence Healthcare,none identified,Plans,not selected,Maryland Heights,#N/A,63043
Luther Mangoba MD INC,none identified,Ambulatory Care Settings,Physician practice,Riverside,#N/A,92503
Lutheran Social Services of Northern California,none identified,Community-Based Organizations,Other community-based service provider,Concord,#N/A,94520
Lutheran Social Services of Southern California,none identified,Community-Based Organizations,Other community-based service provider,Orange,#N/A,92868
"M. Jammal, M.D. Pediatrics",none identified,Ambulatory Care Settings,Physician practice,Roseville,#N/A,95661
"M. Mark Mofid, M.D., A Professional Corporation",none identified,Ambulatory Care Settings,Physician practice,La Jolla,#N/A,92037-1417
M. Nieves Gutierrez-Go M.D. Inc.,none identified,Ambulatory Care Settings,Physician practice,Indio,#N/A,92201
M/S SURGERY CENTER,none identified,Ambulatory Care Settings,Physician practice,Lynwood,#N/A,90262
Mad River Community Hospital,none identified,Acute Care Settings,General acute care hospital,Arcata,#N/A,95521
Madera County Behavioral Health,none identified,Counties,"Behavioral health plan (SMH plans, Medi-Cal RX and DMC-ODS entities)",Madera,#N/A,93639
"Mahmoud Ibrahim, M.D.",none identified,Ambulatory Care Settings,Independent practice associations,Rancho Cucamonga,#N/A,91730
Majid Shahbaz MD Inc.,none identified,Ambulatory Care Settings,Physician practice,La Mesa,#N/A,91942
Mallu C Reddy MD Inc,none identified,Ambulatory Care Settings,Physician practice,Pomona,#N/A,91768
Maltique LLC dba Sherwood Healthcare Center,none identified,Subacute Care Facility,Skilled nursing facility,Sacramento,#N/A,95819-2250
mama baby obgyn inc,none identified,Ambulatory Care Settings,Physician practice,San Jose,#N/A,95128
"Mammography Specialists, LG",none identified,Ambulatory Care Settings,Physician practice,Los Gatos,#N/A,95032
Mammoth Hospital,none identified,Acute Care Settings,not selected,Mammoth Lakes,#N/A,93546
"Man C Duong, MD, APC",none identified,Ambulatory Care Settings,Physician practice,IMPERIAL,#N/A,92251
Managed Health Network,none identified,Plans,Other plan,San Rafael,#N/A,94903
"Mandeep Ayer, M.D.",none identified,Ambulatory Care Settings,Physician practice,Los Gatos,#N/A,95032
Mangrove Medical Group,none identified,Ambulatory Care Settings,Medical group,Chico,#N/A,95926
Manifest MedEx,none identified,Intermediaries,Qualified Health Information Exchange Intermediary Organization (QHIO),Incline Village,#N/A,89451
Manikanda G Raja MD corp,none identified,Ambulatory Care Settings,Physician practice,Hemet,#N/A,92544
"MANJARI ARAVAMUTHAN,M.D.,P.C.",none identified,Ambulatory Care Settings,Physician practice,San Jose,#N/A,95121
Manjul Patwardhan MD Prof Corp,none identified,Ambulatory Care Settings,Physician practice,CUPERTINO,#N/A,95014
Manning Gardens Care Center Inc,none identified,Subacute Care Facility,Skilled nursing facility,Fresno,#N/A,93725
Manorcare Fountain Valley,none identified,Subacute Care Facility,Skilled nursing facility,Fountain Valley,#N/A,92708
ManorCare Health Services (Sunnyvale),none identified,Subacute Care Facility,Skilled nursing facility,Sunnyvale,#N/A,94087
Manorcare Health Services Palm Desert,none identified,Subacute Care Facility,Skilled nursing facility,Palm Desert,#N/A,92260
ManorCare Healthservices - Hemet,none identified,Subacute Care Facility,Skilled nursing facility,Hemet,#N/A,92545
Manual Orthopedic Physical Therapy Inc.,Bodywise Acupuncture & Total Wellness,not selected,not selected,Chula Vista,#N/A,91910
Manzoor A. Kazi Medical Associates Inc.,none identified,Ancillary Care,Other ancillary care provider,Palm Desert,#N/A,92260
Marcia Luisi MD,none identified,Ambulatory Care Settings,Physician practice,Santa Rosa,#N/A,95404
Marcos Borrero MD Inc,none identified,Ambulatory Care Settings,Physician practice,San Diego,#N/A,92154
"Margaret Creek, LMFT 42815",none identified,Community-Based Organizations,Other community-based service provider,San Juan Capistrano,#N/A,92675
"Maria Geraldina Fuentes, MD Inc",none identified,Ambulatory Care Settings,Physician practice,Chula Vista,#N/A,91910
Maria Lourdes S. Mara MD - A Medical Corp,none identified,Ambulatory Care Settings,Physician practice,San Diego,#N/A,92139
Maria Remedios Gopez MD Inc,none identified,Ambulatory Care Settings,Physician practice,Indio,#N/A,92201-5598
MARIE CLAUDETTE GRAGEDA,none identified,Ambulatory Care Settings,Physician practice,Hollister,#N/A,95023
Marin Center for Independent Living,none identified,Community-Based Organizations,Other community-based service provider,San Rafael,#N/A,94901
Marin City Health and Wellness Center,none identified,Ambulatory Care Settings,Federally Qualified Health Center (FQHC),San Rafael,#N/A,94903
Marin Community Clinic,none identified,Ambulatory Care Settings,Federally Qualified Health Center (FQHC),Novato,#N/A,94949
Mario I Brakin,none identified,Ambulatory Care Settings,not selected,Long Beach,#N/A,90815
Mariposa County Health and Human Services,none identified,Counties,County welfare or social services department,Mariposa,#N/A,95338
"Mariya A Zakiuddin, MD, A Medical Corporation",none identified,Ambulatory Care Settings,Physician practice,Burbank,#N/A,91501
Mark C. Adrian M.D. INC.,none identified,Ambulatory Care Settings,Independent practice associations,La Jolla,#N/A,92037
"Mark E. Rosen, DO, Inc.",none identified,Ambulatory Care Settings,Physician practice,Portola Valley,#N/A,94028
Mark Johnson,none identified,Ambulatory Care Settings,Physician practice,Chula Vista,#N/A,91910
Mark Twain Health Care District,Valley Springs Health & Wellness Center,Ambulatory Care Settings,Rural health center (RHC),Valley Springs,#N/A,95252
Marquis Care at Shasta,none identified,Subacute Care Facility,Skilled nursing facility,Redding,#N/A,96002
Marshall Medical Center,none identified,Acute Care Settings,General acute care hospital,Placerville,#N/A,95667
Marta S Sarmiento MD INC,none identified,Ambulatory Care Settings,Physician practice,Orange,#N/A,92868
Martha Meza MD,none identified,Ambulatory Care Settings,Physician practice,Pasadena,#N/A,91105
"Martin Luther King, Jr.-Los Angeles (MLK-LA) Healthcare Corporation",Martin Luther King Jr. Community Medical Foundation,Ambulatory Care Settings,Medical group,Los Angeles,#N/A,90059
Martin M. Bress MD APC,none identified,Ambulatory Care Settings,Physician practice,Hollister,#N/A,95023
"Martin Medical Center, P.C.",none identified,Ambulatory Care Settings,Medical group,Martin,#N/A,38237
Mary Health of the Sick,none identified,Subacute Care Facility,Skilled nursing facility,Newbury Park,#N/A,91320
"Mary Jane Dylla, MD",none identified,Ambulatory Care Settings,Physician practice,Saint Helena,#N/A,94574
"Mary M. Moebius, MD Inc",none identified,Ancillary Care,Other ancillary care provider,Tarzana,#N/A,91356
Mary Regina Pham DDS MS Dental Corporation,Mary R Pham DDS Inc,not selected,not selected,Tustin,#N/A,92780
Mary Regina Pham DDS MS Dental Corporation,Mary Pham Ikeda Dental Corporation,not selected,not selected,Tustin,#N/A,92780
Mary Regina Pham DDS MS Dental Corporation,Mary Pham DDS Dental Corporation,not selected,not selected,Tustin,#N/A,92780
Mary Regina Pham DDS MS Dental Corporation,Mary R Pham DDS Dental Corporation,not selected,not selected,Tustin,#N/A,92780
Mary Regina Pham DDS MS Dental Corporation,Mary Pham Ikeda DDS MS Inc,not selected,not selected,Tustin,#N/A,92780
Masoud Afshar,none identified,Ambulatory Care Settings,Physician practice,IMPERIAL,#N/A,92251
Masoud Afshar MD Inc,none identified,Ambulatory Care Settings,Physician practice,IMPERIAL,#N/A,92251
"Master•Care, Inc.",none identified,Community-Based Organizations,Other community-based service provider,FOLSOM,#N/A,95630
MasterCare,none identified,Community-Based Organizations,Other community-based service provider,FOLSOM,#N/A,95630
"Mathew Isho, M.D., P.C.",none identified,Ambulatory Care Settings,Physician practice,San Diego,#N/A,92103
"Matrix Care Services, LLC",none identified,Ancillary Care,Other ancillary care provider,Encino,#N/A,91316
"Matrix Care Services,LLC",none identified,Ancillary Care,Other ancillary care provider,Encino,#N/A,91316
Matrix Health Promotion,none identified,Ancillary Care,Other ancillary care provider,Encino,#N/A,91316
"Matthew Pifer, MD",none identified,not selected,not selected,Santa Barbara,#N/A,93111
Matthew Schultzel DO & Douglas Sullivan PC,none identified,Ambulatory Care Settings,Other ambulatory care settings,La Jolla,#N/A,92037
"Maureen O. Khoo, MD, Inc.",none identified,Ambulatory Care Settings,Physician practice,Los Gatos,#N/A,95032
"Max V. Soliguen, M.D.",none identified,Ambulatory Care Settings,Physician practice,Upland,#N/A,91786-4087
Mayer MD Inc,none identified,Ambulatory Care Settings,Physician practice,Huntington Park,#N/A,90255
Mayers Memorial Hospital District,none identified,Acute Care Settings,General acute care hospital,Fall River Mills,#N/A,96028
mba,none identified,Ambulatory Care Settings,Physician practice,Riverside,#N/A,92507
McCloud Fire Department,none identified,Emergency Medical Service Providers,not selected,McCloud,#N/A,96057
MD Care and Associates,none identified,Ambulatory Care Settings,Physician practice,El Cajon,#N/A,92020
"MD Care Providers, Inc.",none identified,Ambulatory Care Settings,Physician practice,Hemet,#N/A,92543
MDLC,none identified,Subacute Care Facility,Skilled nursing facility,San Jose,#N/A,95121
Meadow Creek Post-Acute,none identified,Subacute Care Facility,Skilled nursing facility,Paramount,#N/A,90723
"Meadowbrook Post Acute, LLC",none identified,Subacute Care Facility,Skilled nursing facility,Hemet,#N/A,92543
Med Stop Urgent Care Center,none identified,Ambulatory Care Settings,not selected,San Luis Obispo,#N/A,93405
Medhat Mikhael MD Inc DBA Pain Medicine Associates,none identified,Ambulatory Care Settings,Physician practice,Huntington Beach,#N/A,92647
Medical Center Convalescent Hospital,none identified,Subacute Care Facility,Skilled nursing facility,San Bernardino,#N/A,92404-5318
"Medical Diagnostic Laboratories, LLC",none identified,Ancillary Care,Clinical laboratory,Hamilton,#N/A,08690-3303
Medical Diagnostic Laboratory LLC,none identified,Ancillary Care,Clinical laboratory,La Verne,#N/A,91750
Medical offices of Shashwati S. Kale,none identified,Ambulatory Care Settings,Physician practice,San Jose,#N/A,95148
Medical Vision Technology,none identified,Community-Based Organizations,Continuum of Care organization (CoC),Sacramento,#N/A,95816
Medicare Dental Directors,none identified,Plans,Health care service plans and disability insurer,Agoura Hills,#N/A,91301
Medicare Drop,none identified,Ancillary Care,not selected,Campbell,#N/A,95009
"MedZed Physician Services, Inc.",none identified,Ambulatory Care Settings,Physician practice,Culver City,#N/A,90230
Meitri Collaborative,none identified,Ambulatory Care Settings,not selected,San Francisco,#N/A,94102
Melissa Hurd Medical Corporation,none identified,Ambulatory Care Settings,Physician practice,vista,#N/A,92083
melody lynd,none identified,Community-Based Organizations,Other community-based service provider,Campbell,#N/A,95008
"Memorial HealthCare IPA, G.P.",none identified,Ambulatory Care Settings,Independent practice associations,Irvine,#N/A,92618
MEND-Meet Each Need with Dignity,none identified,Community-Based Organizations,Other community-based service provider,Pacoima,#N/A,91331
Mendocino Coast Clinics Inc.,none identified,Ambulatory Care Settings,Federally Qualified Health Center (FQHC),Fort Bragg,#N/A,95437
Mendocino Community Health Clinic Inc.,none identified,Ambulatory Care Settings,Federally Qualified Health Center (FQHC),Ukiah,#N/A,95482
Mennonite Brethren Homes Inc,Mennonite Brethren Homes Inc,Subacute Care Facility,Assisted living facility,Reedley,#N/A,93654
Mennonite Brethren Homes Inc,Mennonite Brethren Homes Inc,Subacute Care Facility,Skilled nursing facility,Reedley,#N/A,93654
Mental Fitness Clinic,none identified,Ambulatory Care Settings,Mental health clinic,Los Angeles,#N/A,90064
Merakey,none identified,Community-Based Organizations,Other community-based service provider,Harrisburg,#N/A,17112
Merced Faculty Associates Medical Group,MFA Atwater,Ambulatory Care Settings,Medical group,Atwater,#N/A,95301-4456
"Merced Faculty Associates Medical Group, Inc.",none identified,Ambulatory Care Settings,Medical group,Merced,#N/A,95341
Meritage Health Plan,none identified,Ambulatory Care Settings,Medical group,Petaluma,#N/A,94954
Meritage Medical Network,none identified,Ambulatory Care Settings,Independent practice associations,Petaluma,#N/A,94954
Metro Family Physicians Medical Group,none identified,Ambulatory Care Settings,Physician practice,San Diego,#N/A,92108
MHM Healthcare,none identified,Intermediaries,Other intermediary,San Bernardino,#N/A,92408
miCare LLC,none identified,Plans,Health care service plans and disability insurer,Clovis,#N/A,93612
"Michael Aguilar, MD",none identified,Ambulatory Care Settings,Physician practice,Sacramento,#N/A,95825
"Michael Bordofsky, M.D.",none identified,Ambulatory Care Settings,Physician practice,Santa Barbara,#N/A,93103
"Michael E. Kan, MD, Inc",none identified,Ambulatory Care Settings,Physician practice,San Jose,#N/A,95128
"Michael K. Tran, M.D., Inc.",none identified,Ambulatory Care Settings,not selected,Westminster,#N/A,92683
Michael M Salehpour MD A Professional Corporation,none identified,Ambulatory Care Settings,Physician practice,ventura,#N/A,93003
Michael Santillan,Pacific Neuropsychiatric Specialists,Community-Based Organizations,Other community-based service provider,MISSION VIEJO,#N/A,92691
"MICHAEL SHABTAI, M.D., INC.",none identified,Community-Based Organizations,Other community-based service provider,Northridge,#N/A,91325
"Michael V. Stulberg, M.D.",none identified,Ambulatory Care Settings,Physician practice,Santa Barbara,#N/A,93105
"Michelle Liske MD, INC",none identified,Ambulatory Care Settings,Physician practice,San Diego,#N/A,92117
"Mid County Physician Medical Group, Inc",none identified,Ambulatory Care Settings,Independent practice associations,San Diego,#N/A,92121
Midcoast imaging,none identified,Acute Care Settings,General acute care hospital,Lompoc,#N/A,93436
MID-PENINSULA EYE PHYSICIANS & SURGEONS MEDICAL GROUP,none identified,Ambulatory Care Settings,Physician practice,San Mateo,#N/A,94401
"Mid-Peninsula Ophthalmology Medical Group, Inc.",none identified,Ambulatory Care Settings,Physician practice,Menlo PArk,#N/A,94025
