Primary_Organization,Subordinate_Organization,Type,Sub_Type,City,County,ZIP
Pursue Health LLC,Thousand Oaks Post Acute,Subacute Care Facility,Skilled nursing facility,Thousand Oaks,#N/A,91360
Pursue Health LLC,Care Center on Hazeltine,Subacute Care Facility,Skilled nursing facility,"Van Nuys,",#N/A,91405
Pursue Health LLC,The Ellison John Transitional Care Center,Subacute Care Facility,Skilled nursing facility,Lancaster,#N/A,93534-4826
Pursue Health LLC,The Springs Healthcare and Rehabilitation Center,Subacute Care Facility,Skilled nursing facility,Murrieta,#N/A,92563
Qingping Wang MD,none identified,Ambulatory Care Settings,Physician practice,SOUTH SAN FRANCISCO,#N/A,94083
Quality Therapeutic Services Inc,none identified,Ambulatory Care Settings,Faculty practice,El Cajon,#N/A,92020
Quartz Hill Post Acute,none identified,Subacute Care Facility,Skilled nursing facility,Redding,#N/A,96003
QueensCare Health Centers,none identified,Ambulatory Care Settings,Federally Qualified Health Center (FQHC),Los Angeles,#N/A,90015
Quest Diagnostics,Quest Diagnostics,Ancillary Care,Clinical laboratory,ventura,#N/A,93003
Quest Diagnostics,Quest Diagnostics,Ancillary Care,Clinical laboratory,Stockton,#N/A,95207
Quest Diagnostics,Quest Diagnostics,Ancillary Care,Clinical laboratory,San Jose,#N/A,95131
Quest Diagnostics,Quest Diagnostics,Ancillary Care,Clinical laboratory,Redlands,#N/A,92373
Quest Diagnostics,Quest Diagnostics,Ancillary Care,Clinical laboratory,Redding,#N/A,96001
Quest Diagnostics,Quest Diagnostics,Ancillary Care,Clinical laboratory,Berkeley,#N/A,94705
Quest Diagnostics,Quest Diagnostics,Ancillary Care,Clinical laboratory,Lynwood,#N/A,90262
Quest Diagnostics,Quest Diagnostics,Ancillary Care,Clinical laboratory,Sacramento,#N/A,95834
Quest Diagnostics,Quest Diagnostics,Ancillary Care,Clinical laboratory,Sacramento,#N/A,95834
Quest Diagnostics,Quest Diagnostics,Ancillary Care,Clinical laboratory,Orange,#N/A,92868
Quest Diagnostics,Quest Diagnostics,Ancillary Care,Clinical laboratory,Arcadia,#N/A,91007
Quest Diagnostics,Quest Diagnostics,Ancillary Care,Clinical laboratory,Riverside,#N/A,92503
Quest Diagnostics,Quest Diagnostics,Ancillary Care,Clinical laboratory,Highland,#N/A,92346
Quest Diagnostics,Quest Diagnostics,Ancillary Care,Clinical laboratory,Fresno,#N/A,93720
Quest Diagnostics,Quest Diagnostics,Ancillary Care,Clinical laboratory,Van Nuys,#N/A,91405
Quest Diagnostics,Quest Diagnostics,Ancillary Care,Clinical laboratory,West Hills,#N/A,91304
Quest Diagnostics,Quest Diagnostics,Ancillary Care,Clinical laboratory,West Hills,#N/A,91304
Quest Diagnostics,Quest Diagnostics,Ancillary Care,Clinical laboratory,West Hills,#N/A,91304
Quest Diagnostics,Quest Diagnostics,Ancillary Care,Clinical laboratory,Merced,#N/A,95341
Quest Diagnostics,Quest Diagnostics,Ancillary Care,Clinical laboratory,San Diego,#N/A,92126
Quest Diagnostics,Quest Diagnostics,Ancillary Care,Clinical laboratory,Bakersfield,#N/A,93311
Quest Diagnostics Nichols Institute,Quest Diagnostics,Ancillary Care,Clinical laboratory,San Juan Capistrano,#N/A,92675-2042
Quest Diagnostics Nichols Institute,Nichols Institute West Hills,Ancillary Care,Clinical laboratory,West Hills,#N/A,91304-3226
R Ruiz M D A Professional Corporation,none identified,Ambulatory Care Settings,Physician practice,Montebello,#N/A,90640
"R. Ruiz, M.D., A Medical Corporation",none identified,Ambulatory Care Settings,Physician practice,RIALTO,#N/A,92376-6523
"Radhey S Bansal,MD Inc",none identified,Ambulatory Care Settings,Medical group,Delano,#N/A,93215
Radiant Health Centers,none identified,Community-Based Organizations,Continuum of Care organization (CoC),Irvine,#N/A,92614
RADIANT PRIMARY CARE,none identified,Acute Care Settings,General acute care hospital,victorville,#N/A,92395
"Radiology Associates of San Luis Obispo, A Medical Group, Inc.",none identified,Ambulatory Care Settings,Medical group,Atascadero,#N/A,934232920
"Raed Al-Naser, MD A Medical Corporation",none identified,Emergency Medical Service Providers,not selected,La Mesa,#N/A,91942
Rahul Grover Inc,none identified,Ambulatory Care Settings,Physician practice,Los Angeles,#N/A,90077
"RAHUL L PATEL, MD",none identified,Ambulatory Care Settings,Physician practice,Manteca,#N/A,95336
Raincross Medical Group,none identified,Ambulatory Care Settings,Medical group,Riverside,#N/A,92506
"RAINCROSS URGENT CARE, INC.",none identified,Ambulatory Care Settings,Urgent care,Riverside,#N/A,92506
Raincross Womens Medical Group,"Alonso R. Ojeda, M.D.",Community-Based Organizations,Other community-based service provider,Riverside,#N/A,92506
Raincross Womens Medical Group,"Serafin Salazar, M.D.",Community-Based Organizations,Other community-based service provider,Riverside,#N/A,92506
Raincross Womens Medical Group,"Leila Magistrado, M.D.",Community-Based Organizations,Other community-based service provider,Riverside,#N/A,92506
"RAMAN CHOPRA MD, INC","JANAK CHOPRA MD, INC",Community-Based Organizations,Other community-based service provider,Garden Grove,#N/A,92843
"Ramona Care, Inc.",none identified,Subacute Care Facility,Skilled nursing facility,El Monte,#N/A,91732
Rancho Family medical group,none identified,Ambulatory Care Settings,Medical group,Menifee,#N/A,92584
Rancho Family medical group,none identified,Ambulatory Care Settings,Medical group,Temecula,#N/A,92590
Rancho Family medical group,none identified,Ambulatory Care Settings,Medical group,Temecula,#N/A,92590
Rancho Family medical group,Rancho Family Medical Group,Ambulatory Care Settings,Medical group,Temecula,#N/A,92590
Rancho Family medical group,none identified,Ambulatory Care Settings,not selected,Hemet,#N/A,92545
Rancho Health MSO,Rancho Family Medical Group,Ambulatory Care Settings,Medical group,Temecula,#N/A,92590
Rancho Health MSO,Primary Medical Group of Ventura County Holdings Inc,Ambulatory Care Settings,Medical group,ventura,#N/A,93001
Rancho Health MSO,San Diego Medical Group,Ambulatory Care Settings,Medical group,San Diego,#N/A,92103
Rancho Medical Clinic,none identified,Ambulatory Care Settings,Physician practice,MORENO VALLEY,#N/A,92553
Rancho Wellness,none identified,Emergency Medical Service Providers,not selected,Rancho Cucamonga,#N/A,91730
Ravenswood Family Health Network,none identified,Ambulatory Care Settings,Federally Qualified Health Center (FQHC),East Palo Alto,#N/A,94303
"Raymond Huang, MD","Raymond Huang, MD",Ambulatory Care Settings,Physician practice,San Jose,#N/A,95124
Razavi Corp. DBA Hilldale Habilitation Center,none identified,Intermediaries,Other intermediary,La Mesa,#N/A,91942
Reach Healthcare,none identified,Community-Based Organizations,Other community-based service provider,San Diego,#N/A,92196
"Rebecca McMahon, LCSW",none identified,Community-Based Organizations,Other community-based service provider,Salida,#N/A,95368
Rebuilding Together Oakland East Bay,none identified,Community-Based Organizations,Other community-based service provider,Oakland,#N/A,94607
RED BLUFF HEALTHCARE CENTER,none identified,Subacute Care Facility,Skilled nursing facility,Red Bluff,#N/A,96080
Red Bluff Unified Elementary School District,none identified,Intermediaries,Other intermediary,Red Bluff,#N/A,96080
"Redding Critical Care Medical Group, Inc",none identified,Ambulatory Care Settings,Medical group,Redding,#N/A,96099
Redding Pain Medicine,none identified,not selected,not selected,Redding,#N/A,96001
Redding Post Acute,none identified,Subacute Care Facility,Skilled nursing facility,Redding,#N/A,96001
"Redding Radiation Oncologists, PC",none identified,Ambulatory Care Settings,Physician practice,Fort Myers,#N/A,33907
Redding Urologic Associates,none identified,Ambulatory Care Settings,Physician practice,Redding,#N/A,96001
Redlands Community Hospital,Redlands Family Clinic,Ambulatory Care Settings,Community clinic or free clinic,Redlands,#N/A,92373
Redlands Community Hospital,Yucaipa Family Clinic,Ambulatory Care Settings,Community clinic or free clinic,Redlands,#N/A,92373
"Redlands Family Practice Medical Group, Inc. dba San Bernadino Medical Group, Inc.","Redlands Family Practice Medical Group, Inc. dba San Bernadino Medical Group, Inc.",Ambulatory Care Settings,Independent practice associations,Corona,#N/A,92879
"Redlands Family Practice Medical Group, Inc. dba San Bernadino Medical Group, Inc.","Redlands Family Practice Medical Group, Inc. dba San Bernadino Medical Group, Inc.",Ambulatory Care Settings,Independent practice associations,Murieta,#N/A,92562
"Redlands Family Practice Medical Group, Inc. dba San Bernadino Medical Group, Inc.","Redlands Family Practice Medical Group, Inc. dba San Bernadino Medical Group, Inc.",Ambulatory Care Settings,Independent practice associations,Ontario,#N/A,91764
"Redlands Family Practice Medical Group, Inc. dba San Bernadino Medical Group, Inc.","Redlands Family Practice Medical Group, Inc. dba San Bernadino Medical Group, Inc.",Ambulatory Care Settings,Independent practice associations,Corona,#N/A,92879
"Redlands Family Practice Medical Group, Inc. dba San Bernadino Medical Group, Inc.","Redlands Family Practice Medical Group, Inc. dba San Bernadino Medical Group, Inc.",Ambulatory Care Settings,Independent practice associations,Ontario,#N/A,91764
"Redlands Family Practice Medical Group, Inc. dba San Bernadino Medical Group, Inc.","Redlands Family Practice Medical Group, Inc. dba San Bernadino Medical Group, Inc.",Ambulatory Care Settings,Independent practice associations,Corona,#N/A,92879
"Redlands Family Practice Medical Group, Inc. dba San Bernadino Medical Group, Inc.","Redlands Family Practice Medical Group, Inc. dba San Bernadino Medical Group, Inc.",Ambulatory Care Settings,Independent practice associations,Ontario,#N/A,91764
"Redlands Family Practice Medical Group, Inc. dba San Bernadino Medical Group, Inc.","Redlands Family Practice Medical Group, Inc. dba San Bernadino Medical Group, Inc.",Ambulatory Care Settings,Independent practice associations,Murrieta,#N/A,92562
Redwood Coast Medical Services,none identified,Ambulatory Care Settings,Federally Qualified Health Center (FQHC),Gualala,#N/A,95445
Redwood Orthopaedic Surgery Associates,none identified,Ambulatory Care Settings,Physician practice,Santa Rosa,#N/A,95403
Redwood Pediatric Medical Group,none identified,Ambulatory Care Settings,Rural health center (RHC),Fortuna,#N/A,95540
Redwoods Rural Health Center,none identified,Ambulatory Care Settings,Federally Qualified Health Center (FQHC),Redway,#N/A,95560
"Regent Medical Group, Inc.","California Pacific Physicians Medical Group, Inc.",Ambulatory Care Settings,Independent practice associations,Cypress,#N/A,90630-0063
REGIONAL HEART CENTER CARDIOLOGY,none identified,Ambulatory Care Settings,Physician practice,Thousand Oaks,#N/A,91360
Rehab Labs,none identified,Ambulatory Care Settings,Rural health center (RHC),Palm Desert,#N/A,92260
Rekha Murali  MD Inc,none identified,Ambulatory Care Settings,Physician practice,San Ramon,#N/A,94583
Reliable Medical Associates,none identified,Ambulatory Care Settings,not selected,Beverly Hills,#N/A,90211
Renaissance Healthcare for Women,none identified,Ambulatory Care Settings,Physician practice,Mountain View,#N/A,94040
Renal Consultants of Ventura County,none identified,Ancillary Care,Other ancillary care provider,Oxnard,#N/A,93036
Renal Medical Group,none identified,Ambulatory Care Settings,Medical group,Visalai,#N/A,93277
ReNew Health Consulting Services,Orinda Care Center,Ancillary Care,Other ancillary care provider,Orinda,#N/A,94563
ReNew Health Consulting Services,Griffith Park Healthcare Center,Ancillary Care,Other ancillary care provider,Glendale,#N/A,91201
ReNew Health Consulting Services,Santa Fe Heights Healthcare Center,Ancillary Care,Other ancillary care provider,Compton,#N/A,91775
ReNew Health Consulting Services,Simi Healthcare Center,Ancillary Care,Other ancillary care provider,SIMI VALLEY,#N/A,93063
ReNew Health Consulting Services,Hyde Park Healthcare Center,Ancillary Care,Other ancillary care provider,SIMI VALLEY,#N/A,93063
ReNew Health Consulting Services,Healthcare Center of Orange County,Ancillary Care,Other ancillary care provider,Buena Park,#N/A,90620
ReNew Health Consulting Services,Redwood Healthcare Center,Ancillary Care,Other ancillary care provider,Oakland,#N/A,94619
ReNew Health Consulting Services,Lake Merritt Healthcare Center,Ancillary Care,Other ancillary care provider,Oakland,#N/A,94610
ReNew Health Consulting Services,Valley Vista Nursing and Transitional Care,Ancillary Care,Other ancillary care provider,North Hollywood,#N/A,91606
ReNew Health Consulting Services,Inland Valley Care and Rehab,Ancillary Care,Other ancillary care provider,Pomona,#N/A,91768
ReNew Health Consulting Services,Holiday Manor Care Center,Ancillary Care,Other ancillary care provider,Canoga Park,#N/A,91306
ReNew Health Consulting Services,Herman Healthcare Center,Ancillary Care,Other ancillary care provider,San Jose,#N/A,95125
ReNew Health Consulting Services,Asistencia Villa Rehab and Care Center,Ancillary Care,Other ancillary care provider,Redlands,#N/A,92373
ReNew Health Consulting Services,Mesa Glen Care Center,Ancillary Care,Other ancillary care provider,Glendora,#N/A,91740
ReNew Health Consulting Services,Rancho Mesa Care Center,Ancillary Care,Other ancillary care provider,Alta Loma,#N/A,91701
ReNew Health Consulting Services,Villa Mesa Care Center,Ancillary Care,Other ancillary care provider,Upland,#N/A,91786
ReNew Health Consulting Services,Chestnut Ridge Post Acute,Ancillary Care,Other ancillary care provider,Glendale,#N/A,91204
ReNew Health Consulting Services,Miracle Mile Healthcare Center,Ancillary Care,Other ancillary care provider,Los Angeles,#N/A,90043
ReNew Health Consulting Services,San Marino Healthcare Center,Ancillary Care,Other ancillary care provider,San Gabriel,#N/A,91775
"Reproductive Health Care Center, Inc.",none identified,Community-Based Organizations,Other community-based service provider,Fullerton,#N/A,92833
Resources For Independent Living,none identified,Community-Based Organizations,Other community-based service provider,Sacramento,#N/A,95814
"Retina Orange County, Inc.",none identified,Ambulatory Care Settings,Physician practice,Irvine,#N/A,92618
Retina-Vitreous Associates Medical Group,none identified,Ambulatory Care Settings,Physician practice,Los Angeles,#N/A,90017
Retirement Housing Foundation,Auburn Ravine Terrace,Ancillary Care,Other ancillary care provider,Auburn,#N/A,95603
Rex Medical,none identified,not selected,not selected,Duarte,#N/A,91010
reza shafee md inc,none identified,Ambulatory Care Settings,Physician practice,Santa Ana,#N/A,92705
RH Community Builders LP,none identified,Community-Based Organizations,Other community-based service provider,Fresno,#N/A,93703
"RheoMed MSO, Inc",none identified,Ambulatory Care Settings,Independent practice associations,Orange,#N/A,92868
Rhonda Rand,none identified,Ambulatory Care Settings,not selected,Beverly Hills,#N/A,90210
Richard K N Ryu MD,none identified,not selected,not selected,Santa Barbara,#N/A,93105
Richmond Post Acute Care,none identified,Subacute Care Facility,Skilled nursing facility,Richmond,#N/A,95662
"Ridgecrest Regional Hospital - Ridgecrest, CA",Ridgecrest Rural Health Clinic,Ambulatory Care Settings,Rural health center (RHC),Ridgecrest,#N/A,93555-3130
"Ridgecrest Regional Hospital - Ridgecrest, CA",Southern Sierra Medical Clinic,Ambulatory Care Settings,Rural health center (RHC),Ridgecrest,#N/A,93555-3130
"Ridgecrest Regional Hospital - Ridgecrest, CA",Ridgecrest Obstetrics,Ambulatory Care Settings,Rural health center (RHC),Ridgecrest,#N/A,93555-3130
"Ridgecrest Regional Hospital - Ridgecrest, CA",China Lake Community Health Clinic,Ambulatory Care Settings,Rural health center (RHC),Ridgecrest,#N/A,93555-3130
RIDGECREST REGIONAL HOSPITAL - RURAL HEALTH CLINIC,none identified,Ambulatory Care Settings,Rural health center (RHC),Ridgecrest,#N/A,93555
Ridgeview Health Center,none identified,Subacute Care Facility,Skilled nursing facility,San Diego,#N/A,92131
RightRX,none identified,Pharmacy,not selected,Brea,#N/A,92821
Ripon Family Physicians,none identified,Ambulatory Care Settings,Physician practice,Ripon,#N/A,95366
Rishu Gupta MD Inc,Rishu Gupta MD Inc,Ambulatory Care Settings,Physician practice,Poway,#N/A,92064
Ritter Center,none identified,Ambulatory Care Settings,Federally Qualified Health Center (FQHC),San Rafael,#N/A,94901
River City Medical Group,none identified,Ambulatory Care Settings,not selected,Sacramento,#N/A,95831
Riverbend Nursing Center,none identified,Subacute Care Facility,Skilled nursing facility,West Sacramento,#N/A,95691
Riverpointe post acute,none identified,Community-Based Organizations,Other community-based service provider,Carmichael,#N/A,95608
"Riverside Care, Inc",Valencia Gardens Health Care Center,Subacute Care Facility,Skilled nursing facility,Riverside,#N/A,92506
"Riverside Community Healthplan Medical Group, Inc. dba, Riverside Physicians Network",none identified,Ambulatory Care Settings,Medical group,Riverside,#N/A,92507
Riverside Family Physicians,none identified,Ambulatory Care Settings,Physician practice,Riverside,#N/A,92506
"Riverside Healthcare and Wellness, LLC",none identified,Subacute Care Facility,Skilled nursing facility,Riverside,#N/A,92503
Riverside Heights Healthcare Center,Arrowhead Healthcare Center,Subacute Care Facility,Skilled nursing facility,San Bernardino,#N/A,92407
Riverside Medical Clinic,none identified,Ambulatory Care Settings,Medical group,Riverside,#N/A,92506
Riverside Medical Clinic Patient Services,none identified,Ambulatory Care Settings,Medical group,Riverside,#N/A,92506
Riverside Medical Clinic Patient Services_UHS,"Riverside Medical Clinic, Inc.",Ambulatory Care Settings,not selected,Riverside,#N/A,92506
Riverside Medical Clinic Patient Services_UHS,Riverside Medical Clinic,Ambulatory Care Settings,Medical group,Riverside,#N/A,92506
Riverside Village Healthcare Center,none identified,Subacute Care Facility,Skilled nursing facility,Riverside,#N/A,92518
Riviera ENT,none identified,Ambulatory Care Settings,Physician practice,Santa Barbara,#N/A,93101
Robert A. Kolarczyk MD,none identified,not selected,not selected,Santa Barbara,#N/A,93101
"Robert H. Brofman, M. D., APC",none identified,Ambulatory Care Settings,Physician practice,Pasadena,#N/A,91101
ROBERT HARTMAN,none identified,not selected,not selected,Los Angeles,#N/A,91316
Robert Houghton MD Inc,none identified,Ambulatory Care Settings,Physician practice,San Diego,#N/A,92101
Robert Kayland MD,none identified,Ambulatory Care Settings,Physician practice,Tarzana,#N/A,91356-3502___
Robert R Anderson MD Inc,none identified,Ambulatory Care Settings,Physician practice,Greenbrae,#N/A,94904
Roberto C. Tongson,none identified,Ambulatory Care Settings,Physician practice,King City,#N/A,93930
Robotic Urology of Santa Barbara,none identified,Ambulatory Care Settings,Physician practice,Santa Barbara,#N/A,93111
Rocklin Family Practice and Sports Medicine,none identified,Ambulatory Care Settings,Physician practice,Rocklin,#N/A,95677
Rogelio Drenning-Manrriquez Inc,Rogelio Drenning-Manrriquez Inc,Ambulatory Care Settings,Medical group,Cathedral City,#N/A,92234
Rogelio Drenning-Manrriquez Inc,Rogelio Drenning-Manrriquez Inc,Ambulatory Care Settings,Medical group,DESERT HOT SPRINGS,#N/A,92240
Rogelio Drenning-Manrriquez Inc,Rogelio Drenning-Manrriquez Inc,Ambulatory Care Settings,Medical group,Riverside,#N/A,92507
"Rogers Behavioral Health California, Inc.",none identified,Ambulatory Care Settings,Physician practice,Oconomowoc,#N/A,53066
ROLAND REINHART MD APC,none identified,Ambulatory Care Settings,Physician practice,Palm Desert,#N/A,92260
Romeo Samouh MD Inc.,none identified,Ambulatory Care Settings,Physician practice,Upland,#N/A,91786
Romesh K Japra MD A Medical Corporation,none identified,Ambulatory Care Settings,Medical group,Fremont,#N/A,94538-2268
Ronald Bush MD INC,none identified,Ambulatory Care Settings,Physician practice,Palm Desert,#N/A,92260
"ROOPA RAO, M.D. INC.",none identified,Ambulatory Care Settings,Physician practice,SIMI VALLEY,#N/A,93065
Roots Food Group,none identified,Community-Based Organizations,Other community-based service provider,Dallas,#N/A,75207
"ROSALIE A. DE GUZMAN, M.D., INC.",none identified,Ambulatory Care Settings,Physician practice,Corona,#N/A,92882
Rose Avenue Family Medical Group,none identified,Ambulatory Care Settings,Physician practice,Oxnard,#N/A,93036
Rose Women's Health,none identified,Ambulatory Care Settings,Physician practice,Arcadia,#N/A,91007
"Rosemarie Tweed, D.O. APC",none identified,Ambulatory Care Settings,Physician practice,MORENO VALLEY,#N/A,92553
Roses Agency Home Care,none identified,Ancillary Care,Other ancillary care provider,Los Angeles,#N/A,90036
Roseville Family Healthcare,none identified,Ambulatory Care Settings,Physician practice,Roseville,#N/A,95661
Rowland Convalescent Hospital,none identified,Subacute Care Facility,Skilled nursing facility,Covina,#N/A,91723
Rowntree Gardens,none identified,Subacute Care Facility,Skilled nursing facility,Stanton,#N/A,90680
"Roy Medical Group, Inc.",none identified,Ambulatory Care Settings,not selected,Woodland Hills,#N/A,91367
"Ruben Ruiz, M.D., A Medical Corporation",none identified,Ambulatory Care Settings,Physician practice,Ontario,#N/A,91762-3207
RUHS ECM Team,RUHS ECM Team,Ambulatory Care Settings,Other ambulatory care settings,Banning CA 9+2220,#N/A,92220
Rupinder Mann MD Inc,none identified,Ambulatory Care Settings,Physician practice,Palm Desert,#N/A,92261
Ryan Ranch Medical Group,none identified,Ambulatory Care Settings,Physician practice,Monterey,#N/A,93940
s j kal inc,none identified,Ambulatory Care Settings,not selected,Northridge,#N/A,91325
S&A Podiatry Clinic,none identified,Ambulatory Care Settings,not selected,Stockton,#N/A,95203
"S.F Valley Congregate Living, Inc",none identified,Subacute Care Facility,Skilled nursing facility,reseda,#N/A,91335
S.M.HAMMAD RIZVI MD INC dba San Antonio Family Medicine group,none identified,Ambulatory Care Settings,Physician practice,Upland,#N/A,91786
Sacramento Colon & Rectal Surgery Medical Group,none identified,Community-Based Organizations,Other community-based service provider,Sacramento,#N/A,95816
Sacramento County Behavioral Health Department,none identified,Counties,"Behavioral health plan (SMH plans, Medi-Cal RX and DMC-ODS entities)",Sacramento,#N/A,95823
"Sacramento Ear, Nose and Throat Inc",none identified,Ambulatory Care Settings,Physician practice,Sacramento,#N/A,95815
"Sacramento Native American Health Center - Sacramento, CA",none identified,Ambulatory Care Settings,Federally Qualified Health Center (FQHC),Sacramento,#N/A,95811
"Sacramento Native American Health Center, Inc",none identified,Community-Based Organizations,Other community-based service provider,Sacramento,#N/A,95811
SacValley MedShare,none identified,Intermediaries,Qualified Health Information Exchange Intermediary Organization (QHIO),Chico,#N/A,95928
"Saina Health, Inc.",none identified,Intermediaries,Health Information Exchange Intermediary Organization (HIO),Menlo PArk,#N/A,94025
Saint Agnes Medical Center,none identified,Acute Care Settings,General acute care hospital,Fresno,#N/A,93720
Saint John's Program for Real Change,none identified,Community-Based Organizations,Continuum of Care organization (CoC),Sacramento,#N/A,95825
"Salida Del Sol CBAS, LLC",none identified,Ancillary Care,Other ancillary care provider,Long Beach,#N/A,90805
"Salinas Valley Emergency Medical Group, INC",none identified,Ambulatory Care Settings,Physician practice,Salinas,#N/A,93902-2420
Salinas Valley Memorial Healthcare System,none identified,Acute Care Settings,General acute care hospital,Salinas,#N/A,93901
"SALINAS VALLEY PLASTIC SURGERY ASSOCIATES, A MEDICAL CORPORATION",none identified,Ambulatory Care Settings,Physician practice,Salinas,#N/A,93902-0417
"SALTZMAN, TANIS, PITTELL, LEVIN & JACOBSON, LLC (d/b/a PEDIATRIC ASSOCIATES)","Coastal Kids, A Professional Medical Corporation",Ambulatory Care Settings,Physician practice,Laguna Hills,#N/A,92653-0101
"SALTZMAN, TANIS, PITTELL, LEVIN & JACOBSON, LLC (d/b/a PEDIATRIC ASSOCIATES)",Pediatric Medical Associates of Sacramento Inc.,Ambulatory Care Settings,Physician practice,Sacramento,#N/A,95825
"SALTZMAN, TANIS, PITTELL, LEVIN & JACOBSON, LLC (d/b/a PEDIATRIC ASSOCIATES)",Valle Verde Pediatrics,Ambulatory Care Settings,Physician practice,Poway,#N/A,92064
Salud Para La Gente,none identified,Ambulatory Care Settings,Federally Qualified Health Center (FQHC),Watsonville,#N/A,95076
"Salus Home Health and Hospice, Inc",none identified,Ambulatory Care Settings,Other ambulatory care settings,Irvine,#N/A,92620
"Sam Kim Physician Services, Inc.",none identified,Ambulatory Care Settings,Physician practice,Beverly Hills,#N/A,90211
Samara P Cardenas MD a PC,none identified,Ambulatory Care Settings,Physician practice,Anaheim,#N/A,92801
Sameh Shenouda MD INC ( DBA: Emmanuel Medical Clinic),none identified,Ambulatory Care Settings,Medical group,Panorama City,#N/A,91402
Samia Botros MD,none identified,Ambulatory Care Settings,Physician practice,Los Gatos,#N/A,95032
"samir n vora, md",none identified,Ambulatory Care Settings,Physician practice,Fremont,#N/A,94538-1730
Sampath Ramakrishnan MD Inc,none identified,Ambulatory Care Settings,Physician practice,Pleasanton,#N/A,94588
Samuel A Bolivar MD,none identified,Ambulatory Care Settings,Physician practice,Riverside,#N/A,92503
"Samuel D Van Kirk MD, Inc",none identified,Ambulatory Care Settings,Physician practice,Redding,#N/A,96001
"Samuel I. Fink, M.D., Inc.",none identified,Ambulatory Care Settings,Physician practice,Tarzana,#N/A,91356
San Antonio Regional Hospital,none identified,Acute Care Settings,General acute care hospital,Upland,#N/A,91786
